{
  "version": "1.4",
  "self_check": {
    "verdict": "review",
    "structural_count": 2,
    "noise_count": 9
  },
  "asset": {
    "schema": "dws",
    "table": "dwb_cust_asset_d",
    "rule_group_code": "GR_CUST_ASSET",
    "rule_group_en": "DWB_CUST_ASSET_D",
    "dialect": "dws",
    "source_type": "execution_tasks.xlsx",
    "analysis_time": "2026-10-19T12:21:55.783156",
    "platform_generation": "1.0"
  },
  "provenance": [
    {
      "type": "execution_tasks",
      "path": "/private/tmp/patent-test/mixed-dir/execution_tasks_DWB_CUST_ASSET_D.xlsx",
      "sheets": [
        "RULE",
        "TargetFields",
        "GroupVariables"
      ]
    }
  ],
  "rules": [
    {
      "rule_code": "R0001",
      "rule_name": "资产明细加工",
      "exec_sequence": 1,
      "scenario_id": "scenario_common",
      "is_common": true,
      "target_schema": "dws",
      "target_table": "tmp_cust_asset_detail",
      "delete_mode": "1",
      "delete_condition": "",
      "write_plan": {
        "kind": "full_truncate",
        "condition_role": "none",
        "condition_expr": null,
        "condition_columns": [],
        "condition_source": "none"
      },
      "query_sql": "SELECT c.cust_id, c.cust_name, a.asset_type, a.balance, a.acct_date FROM ods.ods_acct_balance_di a JOIN ods.ods_cust_info_di c ON a.cust_id = c.cust_id WHERE a.del_flag = 'N' AND a.acct_date = '20260818'",
      "source_tables": [
        "ods.ods_acct_balance_di",
        "ods.ods_cust_info_di"
      ],
      "joins": [
        {
          "source_table": "ods.ods_acct_balance_di",
          "alias": "a",
          "join_type": "FROM",
          "join_condition": ""
        },
        {
          "source_table": "ods.ods_cust_info_di",
          "alias": "c",
          "join_type": "INNER JOIN",
          "join_condition": "a.cust_id = c.cust_id"
        }
      ],
      "where_clause": "WHERE a.del_flag = 'N' AND a.acct_date = '20260818'",
      "group_by": [],
      "is_view_step": false
    },
    {
      "rule_code": "R0002",
      "rule_name": "资产汇总加工",
      "exec_sequence": 2,
      "scenario_id": "scenario_common",
      "is_common": true,
      "target_schema": "dws",
      "target_table": "tmp_cust_asset_sum",
      "delete_mode": "1",
      "delete_condition": "",
      "write_plan": {
        "kind": "full_truncate",
        "condition_role": "none",
        "condition_expr": null,
        "condition_columns": [],
        "condition_source": "none"
      },
      "query_sql": "SELECT cust_id, asset_type, SUM(balance) AS total_balance, COUNT(1) AS record_cnt FROM dws.tmp_cust_asset_detail t GROUP BY t.cust_id, t.asset_type HAVING SUM(t.balance) > 0",
      "source_tables": [
        "dws.tmp_cust_asset_detail"
      ],
      "joins": [
        {
          "source_table": "dws.tmp_cust_asset_detail",
          "alias": "t",
          "join_type": "FROM",
          "join_condition": ""
        }
      ],
      "where_clause": "",
      "group_by": [
        "t.cust_id",
        "t.asset_type"
      ],
      "is_view_step": false
    },
    {
      "rule_code": "R0003",
      "rule_name": "当日分区写入",
      "exec_sequence": 3,
      "scenario_id": "scenario_1",
      "is_common": false,
      "target_schema": "dws",
      "target_table": "dwb_cust_asset_d",
      "delete_mode": "5",
      "delete_condition": "P_CUR",
      "write_plan": {
        "kind": "partition_truncate",
        "condition_role": "partition_expr",
        "condition_expr": "P_CUR",
        "condition_columns": [],
        "condition_source": "delete_condition"
      },
      "query_sql": "SELECT s.cust_id, s.asset_type, s.total_balance, 'CUR' AS data_scope FROM dws.tmp_cust_asset_sum s WHERE s.data_flag = 'D'",
      "source_tables": [
        "dws.tmp_cust_asset_sum"
      ],
      "joins": [
        {
          "source_table": "dws.tmp_cust_asset_sum",
          "alias": "s",
          "join_type": "FROM",
          "join_condition": ""
        }
      ],
      "where_clause": "WHERE s.data_flag = 'D'",
      "group_by": [],
      "is_view_step": false
    },
    {
      "rule_code": "R0004",
      "rule_name": "历史分区写入",
      "exec_sequence": 3,
      "scenario_id": "scenario_2",
      "is_common": false,
      "target_schema": "dws",
      "target_table": "dwb_cust_asset_d",
      "delete_mode": "5",
      "delete_condition": "P_HIS",
      "write_plan": {
        "kind": "partition_truncate",
        "condition_role": "partition_expr",
        "condition_expr": "P_HIS",
        "condition_columns": [],
        "condition_source": "delete_condition"
      },
      "query_sql": "SELECT s.cust_id, s.asset_type, s.total_balance, 'HIS' AS data_scope FROM dws.tmp_cust_asset_sum s WHERE s.data_flag = 'H'",
      "source_tables": [
        "dws.tmp_cust_asset_sum"
      ],
      "joins": [
        {
          "source_table": "dws.tmp_cust_asset_sum",
          "alias": "s",
          "join_type": "FROM",
          "join_condition": ""
        }
      ],
      "where_clause": "WHERE s.data_flag = 'H'",
      "group_by": [],
      "is_view_step": false
    }
  ],
  "tables": [
    {
      "schema": "dws",
      "name": "tmp_cust_asset_detail",
      "table_props": null,
      "fields": [
        {
          "name": "cust_id",
          "type": "",
          "comment": "",
          "is_distribute_key": false
        },
        {
          "name": "cust_name",
          "type": "",
          "comment": "",
          "is_distribute_key": false
        },
        {
          "name": "asset_type",
          "type": "",
          "comment": "",
          "is_distribute_key": false
        },
        {
          "name": "balance",
          "type": "",
          "comment": "",
          "is_distribute_key": false
        },
        {
          "name": "acct_date",
          "type": "",
          "comment": "",
          "is_distribute_key": false
        }
      ]
    },
    {
      "schema": "ods",
      "name": "ods_acct_balance_di",
      "table_props": null,
      "fields": []
    },
    {
      "schema": "ods",
      "name": "ods_cust_info_di",
      "table_props": null,
      "fields": []
    },
    {
      "schema": "dws",
      "name": "tmp_cust_asset_sum",
      "table_props": null,
      "fields": [
        {
          "name": "cust_id",
          "type": "",
          "comment": "",
          "is_distribute_key": false
        },
        {
          "name": "asset_type",
          "type": "",
          "comment": "",
          "is_distribute_key": false
        },
        {
          "name": "total_balance",
          "type": "",
          "comment": "",
          "is_distribute_key": false
        },
        {
          "name": "record_cnt",
          "type": "",
          "comment": "",
          "is_distribute_key": false
        }
      ]
    },
    {
      "schema": "dws",
      "name": "dwb_cust_asset_d",
      "table_props": null,
      "fields": [
        {
          "name": "cust_id",
          "type": "",
          "comment": "",
          "is_distribute_key": false
        },
        {
          "name": "asset_type",
          "type": "",
          "comment": "",
          "is_distribute_key": false
        },
        {
          "name": "total_balance",
          "type": "",
          "comment": "",
          "is_distribute_key": false
        },
        {
          "name": "data_scope",
          "type": "",
          "comment": "",
          "is_distribute_key": false
        }
      ]
    }
  ],
  "lineage": [
    {
      "rule_code": "R0001",
      "target_field": "cust_id",
      "transform_type": "direct",
      "raw_expr": "c.cust_id",
      "physical_sources": [
        {
          "table": "ods.ods_cust_info_di",
          "field": "cust_id"
        }
      ]
    },
    {
      "rule_code": "R0001",
      "target_field": "cust_name",
      "transform_type": "direct",
      "raw_expr": "c.cust_name",
      "physical_sources": [
        {
          "table": "ods.ods_cust_info_di",
          "field": "cust_name"
        }
      ]
    },
    {
      "rule_code": "R0001",
      "target_field": "asset_type",
      "transform_type": "direct",
      "raw_expr": "a.asset_type",
      "physical_sources": [
        {
          "table": "ods.ods_acct_balance_di",
          "field": "asset_type"
        }
      ]
    },
    {
      "rule_code": "R0001",
      "target_field": "balance",
      "transform_type": "direct",
      "raw_expr": "a.balance",
      "physical_sources": [
        {
          "table": "ods.ods_acct_balance_di",
          "field": "balance"
        }
      ]
    },
    {
      "rule_code": "R0001",
      "target_field": "acct_date",
      "transform_type": "direct",
      "raw_expr": "a.acct_date",
      "physical_sources": [
        {
          "table": "ods.ods_acct_balance_di",
          "field": "acct_date"
        }
      ]
    },
    {
      "rule_code": "R0002",
      "target_field": "cust_id",
      "transform_type": "direct",
      "raw_expr": "cust_id",
      "physical_sources": [
        {
          "table": "ods.ods_cust_info_di",
          "field": "cust_id"
        }
      ]
    },
    {
      "rule_code": "R0002",
      "target_field": "asset_type",
      "transform_type": "direct",
      "raw_expr": "asset_type",
      "physical_sources": [
        {
          "table": "ods.ods_acct_balance_di",
          "field": "asset_type"
        }
      ]
    },
    {
      "rule_code": "R0002",
      "target_field": "total_balance",
      "transform_type": "aggregate",
      "raw_expr": "SUM(balance) AS total_balance",
      "physical_sources": [
        {
          "table": "ods.ods_acct_balance_di",
          "field": "balance"
        }
      ]
    },
    {
      "rule_code": "R0002",
      "target_field": "record_cnt",
      "transform_type": "aggregate",
      "raw_expr": "COUNT(1) AS record_cnt",
      "physical_sources": []
    },
    {
      "rule_code": "R0003",
      "target_field": "cust_id",